{
  "id": "sahih-al-bukhari",
  "tradition": "islam",
  "names": {
    "primary": "Sahih al-Bukhari",
    "original": "صحيح البخاري",
    "transliteration": "Ṣaḥīḥ al-Bukhārī",
    "aliases": [
      "al-Jami' al-Sahih",
      "The Sahih of al-Bukhari"
    ]
  },
  "category": "hadith collection",
  "date": {
    "year": 846,
    "note": "Compiled by Muhammad ibn Isma'il al-Bukhari (d. 256/870) over some years in the mid-ninth century; the year given is approximate. The collection is arranged by topics of jurisprudence."
  },
  "summary": "Sahih al-Bukhari is a ninth-century collection of prophetic hadith compiled by al-Bukhari (d. 256/870), arranged by legal topic and restricted to reports its compiler judged sound (sahih). In later Sunni tradition it is regarded, together with Sahih Muslim, as the most authoritative of the hadith collections.",
  "description": "Sahih al-Bukhari, whose full title is al-Jami' al-Sahih, is a topical collection of prophetic traditions (hadith) assembled by Muhammad ibn Isma'il al-Bukhari (d. 256/870). It restricts itself to reports its compiler judged to meet a strict standard of soundness (sahih), selected from a far larger body of circulating traditions, and arranges them under headings of ritual, law, creed, and conduct. Over the following centuries the work came to be treated in Sunni scholarship as second in authority only to the Qur'an among books, and together with Sahih Muslim it forms the pair known as the two Sahihs (al-Sahihayn), the most authoritative of the six major Sunni collections. Modern scholarship studies how the collection moved from being one respected work among many to occupying this canonical status, and the roles it came to play in Sunni ritual, law, and identity.",
  "editorial_notes": "This entry describes the collection and its standing within Sunni tradition, attributing the judgment of authority to that tradition rather than asserting the soundness of the reports, per neutrality principles #1 and #4. The compiler is linked under the id bukhari; the historical figure is al-Bukhari (d. 256/870). Sources triangulate three lenses per neutrality principles #8 and #9: outside academic scholarship (Jonathan A. C. Brown, The Canonization of al-Bukhari and Muslim, Brill 2007), the collection itself as the primary text, and a contemporary Muslim scholar (Brown, Hadith, Oneworld 2009). Brown is a contemporary Muslim scholar of hadith, so his monograph serves both the academic and contemporary-Muslim lenses; the collection supplies the classical primary text. No encyclopedias or tertiary sources are cited. Confidence is medium: sources verified to exist and be on-topic but not read line-by-line. The composition year is approximate and qualified in the date note.",
  "relations": [
    {
      "type": "authored_by",
      "target": "bukhari",
      "note": "Compiled by Muhammad ibn Isma'il al-Bukhari (d. 256/870)."
    },
    {
      "type": "related_to",
      "target": "ahl-al-hadith",
      "note": "The collection belongs to and is a central text of the traditionist (ahl al-hadith) project of preserving and sifting prophetic reports."
    }
  ],
  "sources": [
    {
      "citation": "Brown, Jonathan. The Canonization of al-Bukhari and Muslim: The Formation and Function of the Sunni Hadith Canon. Islamic History and Civilization 69. Leiden and Boston: Brill, 2007. Academic monograph tracing how the two Sahihs became the authoritative Sunni hadith canon; the outside-scholarship lens.",
      "url": "https://brill.com/display/title/12924",
      "license": "Proprietary; cited for reference, relevant passages not read line-by-line.",
      "accessed": "2026-07-19",
      "confidence": "medium"
    },
    {
      "citation": "al-Bukhari, Muhammad ibn Isma'il. al-Jami' al-Sahih (Sahih al-Bukhari). Classical topically-arranged collection of prophetic hadith judged sound by its compiler (d. 256/870); the primary-text lens.",
      "license": "Public-domain classical text; cited for reference; relevant passages not read line-by-line.",
      "accessed": "2026-07-19",
      "confidence": "medium"
    },
    {
      "citation": "Brown, Jonathan A. C. Hadith: Muhammad's Legacy in the Medieval and Modern World. Foundations of Islam. Oxford: Oneworld Publications, 2009. A contemporary Muslim scholar's survey of hadith, its collection, and its authority; the contemporary Muslim scholar lens.",
      "url": "https://oneworld-publications.com/work/hadith/",
      "license": "Proprietary; cited for reference, relevant passages not read line-by-line.",
      "accessed": "2026-07-19",
      "confidence": "medium"
    }
  ],
  "status": "reviewed",
  "schema_version": "0.3.0",
  "created": "2026-07-19",
  "updated": "2026-10-18"
}
